<?xml version="1.0" encoding="UTF-8"?>
<blackBoxWrapperConfig xmlns="http://www.openda.org"
                       xmlns:xsi="http://www.w3.org/2001/XMLSchema-instance"
                       xsi:schemaLocation="http://www.openda.org http://schemas.openda.org/blackBoxWrapperConfig.xsd">

<!-- declare all the used aliases, specify the prefix and suffix of an alias key in a variable  -->
   <aliasDefinitions defaultKeyPrefix="%" defaultKeySuffix="%" >
      <alias key="DELFT3DBINDIR" />
      <alias key="OPENDADIR"/>
      <alias key="instanceDir"/>
      <alias key="templateDir" />
      <alias key="runid"/>
      <alias key="roughParamsFile"/>
      <!--
      <alias key="roughness"/>
      -->
       <alias key="exedir"/>
    </aliasDefinitions>

   <run>
      <!-- for each model instance, the template directory will be cloned to create the instance directory -->
      <initializeActionsUsingDirClone instanceDir="%instanceDir%%instanceNumber%" templateDir="%templateDir%"/>

      <!-- computation actions -->
      <!-- define actions relative to working dir. -->
      <computeActions>
  	 <action workingDirectory="%instanceDir%" windowsExe="%exedir%\d_hydro.exe" linuxExe="%DELFT3DBINDIR%/d_hydro.sh">
            <arg>config_d_hydro.xml</arg>
         </action>
      </computeActions>

      <finalizeActions/>
   </run>

   <inputOutput>

      <!-- u/v rougness -->
      <ioObject className="org.openda.model_delft3d.D3dField2DFile">
         <file>%runid%.mdf</file>
         <id>roughness</id>
         <arg>rgh</arg>
      </ioObject>

      <!-- depth -->
      <ioObject className="org.openda.model_delft3d.D3dField2DFile">
         <file>%runid%.mdf</file>
         <id>depth</id>
         <arg>dep</arg>
      </ioObject>

      <!-- astro -->
      <ioObject className="org.openda.model_delft3d.D3dAstroComponentFiles">
         <file>%runid%.mdf</file>
         <id>astro-components</id>
      </ioObject>

      <!-- time series results -->
      <ioObject className="org.openda.model_delft3d.D3dNetcdfHisDataObject">
         <file>trih-%runid%.nc</file>
         <id>trih-file</id>
         <arg>true</arg>
      </ioObject>

      <!-- river rougness -->
      <ioObject className="org.openda.model_delft3d.D3dRoughParamsFile">
         <file>%roughParamsFile%</file>
         <id>roughParams</id>
      </ioObject>

   </inputOutput>

</blackBoxWrapperConfig>
