<?xml version="1.0" encoding="UTF-8"?>
<blackBoxWrapperConfig xmlns="http://www.openda.org" xmlns:xsi="http://www.w3.org/2001/XMLSchema-instance" xsi:schemaLocation="http://www.openda.org http://schemas.openda.org/blackBoxWrapperConfig.xsd">

	<aliasDefinitions defaultKeyPrefix="%" defaultKeySuffix="%" >
		<alias key="DAMFLOWDIR"/>
		<alias key="templateDir"/>
		<alias key="instanceDir"/>
		<alias key="inputFileName"/>
        <alias key="outFile"/>
	</aliasDefinitions>

	<run>

		<!-- for each model instance, the template directory will be cloned to create the instance directory -->
		<initializeActionsUsingDirClone instanceDir="output/%instanceDir%%instanceNumber%" templateDir="%templateDir%"/>

		<computeActions>
			<action workingDirectory="%instanceDir%" windowsExe="%DAMFLOWDIR%/bin/DikeFlow.exe">
				<arg>%inputFileName%</arg>
				<!-- TODO: check if it is actually possible to use other name than dupuit -->
				<checkOutput file="%inputFileName%.C001" /> <!-- should exist -->
			</action>
			<!--
			This is not needed. The updated state is automatically written into *.C000 file just before the
			next computeActions. But we still need to consult John van Esch about the correct restart procedure.
			<action workingDirectory="%instanceDir%" windowsExe="%DAMFLOWDIR%/bin/setInitialState.bat">
				<arg>%inputFileName%.C001</arg>
				<arg>%inputFileName%.C000</arg>
			</action>			
			-->
		</computeActions>

		<finalizeActions/>

	</run>


<inputOutput>

	<dataObject className="org.openda.model_damflow.DupuitCFile">
		<file>%inputFileName%.C000</file>
		<id>dupuitC</id>
		<arg></arg>
	</dataObject>

	<dataObject className="org.openda.model_damflow.DupuitPFile">
		<file>%inputFileName%.P</file>
		<id>dupuitP</id>
		<arg></arg>
	</dataObject>

	<dataObject className="org.openda.model_damflow.DupuitBHOFile">
		<file>%inputFileName%.O</file>
		<id>dupuitO</id>
		<arg></arg>
	</dataObject>

	<dataObject className="org.openda.model_damflow.DupuitBHOFile">
		<file>%inputFileName%.B</file>
		<id>dupuitB</id>
		<arg></arg>
	</dataObject>

	<dataObject className="org.openda.model_damflow.DupuitGFile">
		<file>%inputFileName%.G</file>
		<id>dupuitG</id>
		<arg></arg>
	</dataObject>

</inputOutput>

</blackBoxWrapperConfig>
