<?xml version="1.0" encoding="UTF-8"?>
<blackBoxWrapperConfig xmlns="http://www.openda.org"
                       xmlns:xsi="http://www.w3.org/2001/XMLSchema-instance"
                       xsi:schemaLocation="http://www.openda.org http://schemas.openda.org/blackBoxWrapperConfig.xsd">

<!-- declare all the used aliases, specify the prefix and suffix of an alias key in a variable  -->
   <aliasDefinitions defaultKeyPrefix="%" defaultKeySuffix="%" >
      <alias key="D3D_HOME" />
      <alias key="OPENDADIR"/>
      <alias key="instanceDir"/>
      <alias key="templateDir" />
      <alias key="runid"/>
      <alias key="exedir"/>
      <alias key="linexedir"/>
    </aliasDefinitions>

   <run>
      <initializeActionsUsingDirClone instanceDir="%instanceDir%%instanceNumber%" templateDir="%templateDir%"/>

		  <computeActions>
			<action workingDirectory="%instanceDir%" windowsExe="%exedir%\d_hydro.exe" linuxExe="%linexedir%/d_hydro.exe">
				<arg>config_flow2d3d.xml</arg>
			 </action>
            <action workingDirectory=".\" exe=".\scripts\copyResults.bat">
                <arg>work1</arg>
                <arg>..\resultsTemp</arg>
            </action>
		  </computeActions>
	  
          <finalizeActions>
            <action workingDirectory=".\" exe=".\scripts\concatenateResults.bat">
                <arg>..\resultsTemp</arg>
                <arg>..\..\results</arg>
            </action>
          </finalizeActions>
   </run>

   <inputOutput>

      <!-- Model Input File -->
      <dataObject className="org.openda.model_delft3d.D3dMdFileDataObject">
         <file>%runid%.mdf</file>
         <id>mdFile</id>
      </dataObject>

      <!-- time series results -->
      <dataObject className="org.openda.model_delft3d.NetcdfD3dHisDataObject">
         <file>trih-%runid%.nc</file>
         <id>trih-file</id>
      </dataObject>
	  
	  <!-- input forcing -->
	  		<!-- wind, u- direction -->
		<dataObject className="org.openda.model_delft3d.D3dWindFile">
			<file>%runid%.mdf</file>
			<id>windwuFile</id>
			<arg>wu</arg>
		</dataObject>

		<!-- wind, v- direction -->
		<dataObject className="org.openda.model_delft3d.D3dWindFile">
			<file>%runid%.mdf</file>
			<id>windwvFile</id>
			<arg>wv</arg>
		</dataObject>

		<!-- Reading the model states -->
		<dataObject className="org.openda.model_delft3d.NetcdfD3dMapDataObject">
			<file>trim-%runid%.nc</file>
			<id>states</id>
		    <arg>tri-rst.restart-in</arg>
		    <arg>%targetTime%</arg>
		</dataObject>

	</inputOutput>

</blackBoxWrapperConfig>
