<?xml version="1.0" encoding="UTF-8"?>
<blackBoxWrapperConfig xmlns="http://www.openda.org"
                       xmlns:xsi="http://www.w3.org/2001/XMLSchema-instance"
                       xsi:schemaLocation="http://www.openda.org http://www.schemas.openda.org/blackBoxWrapperConfig.xsd">

	<!-- declare all the used aliases, specify the prefix and suffix of an alias key in a variable  -->
	<aliasDefinitions defaultKeyPrefix="%" defaultKeySuffix="%" >
		<alias key="D3D_HOME" />
		<alias key="NATIVE_DLL_DIR" value="..\..\..\..\..\..\..\bin"/>
		<alias key="instanceDir"/>
		<alias key="templateDir" value="../model"/>
		<alias key="runid"/>
		<alias key="roughness"/>
        <alias key="exedir"/>
    </aliasDefinitions>

	<run>

		<!-- for each model instance, the template directory will be cloned to create the instance directory -->
		<initializeActionsUsingDirClone instanceDir="%instanceDir%%instanceNumber%" templateDir="%templateDir%"/>

		<!-- computation actions -->
		<!-- define actions relative to working dir. -->
		<computeActions>
			<action workingDirectory="%instanceDir%" exe="%exedir%\deltares_hydro.exe">
				<arg>config_d_hydro.xml</arg>
			</action>
		</computeActions>
		<!--additionalComputeActions>
			<action workingDirectory="%instanceDir%" linuxExe="%OPENDADIR%/delftFlowRunWait.sh">
				<arg>%runid%</arg>
				<arg>%runid%_%instanceNumber%</arg>
			</action>
		</additionalComputeActions-->

		<!-- actions to finalize (e.g. cleanup) an instance -->
		<finalizeActions/>

	</run>

	<inputOutput>

	<!-- astro -->
		<dataObject className="org.openda.model_delft3d.D3dAstroComponentFiles">
			<file>%runid%.mdf</file>
		<id>astro-components</id>
	</dataObject>

		<!-- u/v rougness -->
		<dataObject className="org.openda.model_delft3d.D3dField2DFile">
			<file>%runid%.mdf</file>
			<id>roughness</id>
			<arg>rgh</arg>
		</dataObject>


		<!-- depth -->
		<dataObject className="org.openda.model_delft3d.D3dField2DFile">
			<file>%runid%.mdf</file>
			<id>depth</id>
			<arg>dep</arg>
		</dataObject>

		<!-- wind, u- direction -->
		<dataObject className="org.openda.model_delft3d.D3dWindFile">
			<file>%runid%.mdf</file>
			<id>windguFile</id>
			<arg>gu</arg>
		</dataObject>

		<!-- wind, v- direction -->
		<dataObject className="org.openda.model_delft3d.D3dWindFile">
			<file>%runid%.mdf</file>
			<id>windgvFile</id>
			<arg>gv</arg>
		</dataObject>

		<!-- time series results -->
		<dataObject className="org.openda.model_delft3d.D3dResults">
			<file>trih-%runid%.dat</file>
			<id>trih-file</id>
			<arg>%NATIVE_DLL_DIR%</arg>
		</dataObject>
	</inputOutput>

</blackBoxWrapperConfig>
